{
  "schema_version": "1.0.0",
  "artifact_type": "continuity_brief_part",
  "artifact_id": "continuity-part-sessions-{{sid}}-{{ts}}",
  "session_id": "{{sid}}",
  "stage": "cross-session",
  "producer_agent": "scout-sessions",
  "created_at": "{{produced_at}}",
  "status": "sentinel",
  "verdict": "n/a",
  "inputs": [],
  "outputs": [
    {"path": ".orchestrate/{{sid}}/continuity-brief/parts/scout-sessions.json", "role": "primary"}
  ],
  "body": {
    "sections": {
      "recent_outcomes": [],
      "open_risks": []
    },
    "counts": {"sessions_read": 0, "residual_raids": 0},
    "conflicts_detected": [],
    "confidence_local": 0.0
  }
}
